{
  "schemaVersion": "benchmark.model_manifest.v1",
  "modelId": "lfm25-8b-a1b-local",
  "displayName": "LFM2.5 8B A1B Local",
  "provider": "Liquid AI",
  "runtime": "ollama",
  "runtimeModelName": "hf.co/LiquidAI/LFM2.5-8B-A1B-GGUF:latest",
  "status": "available",
  "capabilities": [
    "structured-output",
    "intent-classification"
  ],
  "notes": [
    "Local Ollama manifest generated from installed Hugging Face GGUF model."
  ]
}
