{
  "schemaVersion": "benchmark.model_manifest.v1",
  "modelId": "llama3.2-local",
  "displayName": "Llama 3.2 Local",
  "provider": "Meta",
  "runtime": "ollama",
  "runtimeModelName": "llama3.2",
  "status": "available",
  "capabilities": [
    "structured-output",
    "intent-classification"
  ],
  "notes": [
    "Local Ollama manifest for Benchmark Lab runs against the installed llama3.2 model.",
    "Availability means the manifest targets a real local runtime; qualification still requires approved evidence."
  ]
}
